Projektname;Art;Einsatzbereich;Quelle;Organisation;Status;Kurzzusammenfassung;Projekt-Abkürzung;Webseite-Link
Forschungsdatenzentrum des Forschungsinstituts Gesellschaftlicher Zusammenhalt;Datenportal, Datenerhebung, Datenanalyse, Datensatz und Visualisierung, Monitoring, Bericht, Interaktive App;Demokratie, Soziale Arbeit, Wissensmanagement, International, Partizipation;https://fgz-risc-data.de/;Forschungsinstitut Gesellschaftlicher Zusammenhalt, Universität Bremen, RatSWD, Qualiservice;In Weiterentwicklung;Das Forschungsdatenzentrum des FGZ entwickelt eine Dateninfrastruktur zur Analyse des gesellschaftlichen Zusammenhalts. Es sammelt, archiviert und stellt quantitative und qualitative Daten für die wissenschaftliche Nutzung sowie interaktive Tools und Berichte zur Verfügung.;FDZ-FGZ;https://fgz-risc-data.de/
Datenportal für die Rassismus- und Rechtsextremismusforschung;Datenanalyse, Datenerhebung, Datensatz und Visualisierung, Digitale Plattform, Interaktive App, Offene Daten;Antidiskriminierung, Antirassismus, Demokratie, Forschung, Offene Daten;https://www.dezim-institut.de/projekte/projekt-detail/datenportal-fuer-die-rassismus-und-rechtsextremismusforschung-dp-r-ex-4-11/;GESIS, Qualiservice an der Universität Bremen, Hans-Bredow-Institut, DeZIM;Eingestellt;Das Projekt DP-R|EX verbessert die Forschungsdateninfrastruktur für die Rassismus- und Rechtsextremismusforschung. Es entwickelt ein Metadatenschema, Prozesse für die föderierte Archivierung und einen „Data Explorer“, der Nutzern das Generieren von Verteilungen aus Datensätzen ermöglicht.;DP-R|EX;https://www.gesis.org/forschung/drittmittelprojekte/details/project/187/datenportal-fuer-die-rassismus-und-rechtsextremismusforschung
ACTIVATE bei Diabetes;Digitale Plattform;Telemedizin;https://pubmed.ncbi.nlm.nih.gov/37201542/;CITRIS Health, USA;Unbekannt;;;
Analyse- und Recherche-Software zur KI-gestützten Analyse antidemokratischer Bewegungen online (ARAI);KI Anwendung, Datenanalyse, Digitale Plattform;Demokratie, Menschenrechte, Transparenz;https://www.htw-berlin.de/forschung/online-forschungskatalog/projekte/projekt/?eid=3606;Hochschule für Technik und Wirtschaft Berlin;Unbekannt;Das Projekt ARAI entwickelt eine KI-gestützte Analyse- und Recherche-Software, um antidemokratische Bewegungen im Internet zu identifizieren und zu analysieren.;ARAI;
Prozessdigitalisierung bei der Sächsischen Jugendstiftung;Digitale Workflows, Datenkultur;Jugendarbeit, Teilhabe, Ehrenamt;https://genialsozial - Sächsische Jugendstiftung;Sächsische Jugendstiftung;Unbekannt;Beim jährlichen Aktionstag genialsozial der Sächsischen Jugendstiftung engagieren sich viele tausend Schüler*innen, indem sie den Lohn eines freiwilligen Arbeitstages spenden. Um den Verwaltungsaufwand für Anmeldung und Abrechnung zwischen Verein und Schulen zu bewältigen, wurde ein digitales Formular entwickelt, das bisher noch zu wenig angenommen wird. Gemeinsam stärken wir die Akzeptanz für digitale Prozesse und schaffen eine gute Basis für die automatisierte Nutzung von Daten. Zugleich wird ein Verfahren zur Digitalisierung von Handschriften (Computer Vision) geprüft.;;https://genialsozial - Sächsische Jugendstiftung
