Quelle;Projektname;Art;Einsatzbereich;Webseite-Link;Organisation;Status;Kurzzusammenfassung;Projekt-Abkürzung;Lizenz;Lizenz-Organisation
https://www.civic-coding.de/community-information/projekte/vorschauseite-projekt/org-ai-nisation-smartes-dienstplanungstool-fur-faire-arbeitsbedingungen-im-gesundheitswesen/819;Org-AI-nisation: Smartes Dienstplanungstool für faire Arbeitsbedingungen im Gesundheitswesen;KI Anwendung, Prozessautomatisierung, Entscheidungsassistent;Gesundheit, Pflege;;Civic Coding;In Planung;Die Dienstplanung in Kliniken ist komplex und daher sind die Bedürfnisse des Personals oft zweitrangig. Unser KI-gestütztes Tool soll eine dynamische, faire und transparente Planung ermöglichen, indem individuelle Präferenzen und Rückmeldungen des Personals berücksichtigt werden.;;CC-BY-NC-ND 4.0;https://www.civic-coding.de
https://www.civic-coding.de/community-information/projekte/vorschauseite-projekt/tinder-fur-arbeitsplaetze-fur-mehr-matches-auf-dem-arbeitsmarkt/815;"Tinder für Arbeitsplätze - Für mehr ""Matches"" auf dem Arbeitsmarkt";KI Anwendung, Matching;Arbeit, Chancengleichheit;;Civic Coding – Innovationsnetz KI für das Gemeinwohl;In Planung;Viele Menschen haben Probleme bei der Suche nach einer Arbeitsstelle. Wir wollen diesem Problem mit einem KI-gestützten Algorithmus, das sich am „Tinder-Swipen“ orientiert, entgegentreten und für mehr „Matches“ auf dem Arbeitsmarkt sorgen.;;CC-BY-NC-ND 4.0;https://www.civic-coding.de
https://www.civic-coding.de/community-information/projekte/vorschauseite-projekt/stereoff-automatisierte-identifikation-und-analyse-von-geschlechterstereotypen/814;StereOFF - Automatisierte Identifikation und Analyse von Geschlechterstereotypen;KI Anwendung, Datenanalyse;Antidiskriminierung, Gleichberechtigung, Gleichstellung;;;In Planung;Um Geschlechterungleichheiten in der Gesellschaft entgegenzuwirken, entwickeln wir das Tool StereoOff, das Geschlechterstereotype in Lernmaterialien des Aus- und Weiterbildungsbereichs automatisiert identifiziert und langfristig auf vielfältige Domänen übertragen werden kann.;StereOFF;CC-BY-NC-ND 4.0;https://www.civic-coding.de
https://www.civic-coding.de/community-information/projekte/vorschauseite-projekt/112-ki-rettet-leben/813;112 - KI rettet Leben.;KI Anwendung, Entscheidungsassistent, Datenanalyse, Analyse von Sensordaten und ML;Rettungsdienst, Katastrophenschutz;;;In Planung;Jede Sekunde zählt beim Notruf. 30% der Anrufe senden keine GPS Daten, weshalb durch Abfragen der Standort bestimmt werden muss. Dies kann akustisch extrem schwierig sein. Unser KI-System unterstützt die Anrufzentrale um die Person zu lokalisieren – und Hilfe zu schicken.;;CC-BY-NC-ND 4.0;https://www.civic-coding.de
https://www.civic-coding.de/community-information/projekte/vorschauseite-projekt/kiring-new-employees-effiziente-social-media-praesenz-durch-innovative-technologie/811;>KI<ring new employees: Effiziente Social Media-Präsenz durch innovative Technologie;KI Anwendung, Generative KI;Arbeit, Verwaltung;;;In Planung;Diese Projektidee setzt auf KI in Human Ressources, um die Social Media Präsenz von Kleinbetrieben, Kommunen sowie Handwerksbetrieben zu stärken und dem Fachkräftemangel entgegenzuwirken. KI erstellt individuelle Inhalte, um die Reichweite und Personalbeschaffung zu verbessern.;;CC-BY-NC-ND 4.0;https://www.civic-coding.de
https://www.civic-coding.de/community-information/projekte/vorschauseite-projekt/senior-residenz-soziale-aktivitaeten-vorschlagende-und-organisatorin/810;Senior Residenz Soziale Aktivitäten Vorschlagende und Organisatorin;Interaktive App, KI Anwendung, Entscheidungsassistent, Matching;Senioren, Mentale Gesundheit, Teilhabe, Vernetzung;;;In Planung;Eine App schlägt vor, fördert, organisiert und unterstützt soziale Aktivitäten, die auf die individuellen Profile der Bewohner eines Seniorenheims zugeschnitten sind, und zwar im Kontext der Einrichtungen und der lokalen Umgebung.;;CC-BY-NC-ND 4.0;https://www.civic-coding.de
https://www.civic-coding.de/community-information/projekte/vorschauseite-projekt/fr-ai-willig-ki-asisstent-fur-vereine/809;Fr-AI-willig: KI Asisstent für Vereine;KI Anwendung, Chatbot, Prozessautomatisierung, Interaktive App;Verwaltung, Ehrenamt;;;In Planung;KI-unterstützter Chatbot für Vereine: Effiziente Verwaltung von Kommunikation, Terminen, Projekten, Finanzen und administrativen Aufgaben. Entlastet ehrenamtliche Führung und sorgt für reibungslose Prozesse. Intuitiv zu nutzen, zeitsparend, kosteneffektiv und zuverlässig.;;CC-BY-NC-ND 4.0;https://www.civic-coding.de
https://www.civic-coding.de/community-information/projekte/vorschauseite-projekt/speaksense-ai-diagnostics-a-voice-based-ai-solution-for-detecting-and-diagnosing-depression/807;SpeakSense AI Diagnostics: A voice-based AI solution for detecting and diagnosing depression.;KI Anwendung, Analyse von Sensordaten und ML, Interaktive App;Gesundheit, Mentale Gesundheit;;Civic Coding;In Planung;SpeakSense AI Diagnostics - Revolutionizing medical diagnosis with AI. Our voice-based application accurately detects and diagnoses depression and suicidal persons based on speech patterns and voice characteristics. Making healthcare more accessible and efficient. #AIDiagnostics.;#AIDiagnostics;CC-BY-NC-ND 4.0;https://www.civic-coding.de
https://www.civic-coding.de/community-information/projekte/vorschauseite-projekt/karriere-ki-ckstart/805;Karriere-KI-ckstart;KI Anwendung, Entscheidungsassistent, Datenanalyse, Digitale Plattform;Beratung, Wissensmanagement;https://www.civic-coding.de/community-information/projekte/vorschauseite-projekt/karriere-ki-ckstart/805;Civic Coding, Bundesministerium für Arbeit und Soziales (BMAS), Bundesministerium für Bildung, Familie, Senioren, Frauen und Jugend (BMFSFJ), Bundesministerium für Umwelt, Klimaschutz, Naturschutz und nukleare Sicherheit (BMUKN), Bundesministerium für Digitales und Staatsmodernisierung (BMDS);In Betrieb;KI-basierter Chatbot hilft bei Karriere durch personalisierte Jobempfehlungen, beschleunigte Bewerbungsprozesse und 24/7 Verfügbarkeit. Stärken werden verbessert, Fähigkeiten identifiziert. Ressourcen und Datenanalyse unterstützen Fortschritt in Bewerbung und Karriereentwicklung.;;CC-BY-NC-ND 4.0;https://www.civic-coding.de
https://www.civic-coding.de/community-information/projekte/vorschauseite-projekt/ideationai-neue-ideen-und-loesungen-durch-ki-gestutzte-ideation/803;IdeationAI: Neue Ideen und Lösungen durch KI-gestützte Ideation;Generative KI, KI Anwendung, Entscheidungsassistent;Wissensmanagement, Partizipation, Demokratie;https://www.civic-coding.de/community-information/projekte/vorschauseite-projekt/ideationai-neue-ideen-und-loesungen-durch-ki-gestutzte-ideation/803;Civic Coding – Innovationsnetz KI für das Gemeinwohl;In Planung;IdeationAI hilft dabei Probleme zu identifizieren und innovative Lösungen zu generieren. Mit Hilfe von künstlicher Intelligenz wird eine breite Palette an Lösungsoptionen erstellt und anschließend bewertet, was die Chancen auf erfolgreiche Innovationen erhöht.;;CC-BY-NC-ND 4.0;https://www.civic-coding.de
https://www.civic-coding.de/community-information/projekte/vorschauseite-projekt/ki-unterstutztes-sensemaking-als-mittel-zur-depolarisierung-der-gesellschaft/802;KI-unterstütztes Sensemaking als Mittel zur Depolarisierung der Gesellschaft;KI Anwendung, Datenanalyse;Demokratie, Partizipation, Vernetzung;https://www.civic-coding.de/community-information/projekte/vorschauseite-projekt/ki-unterstutztes-sensemaking-als-mittel-zur-depolarisierung-der-gesellschaft/802;;In Planung;Unsere Gesellschaft ist durch eine starke Tendenz der Polarisierung geprägt, die zu sozialen Spannungen innerhalb der Gesellschaft führt. Mithilfe eines KI-unterstüztes Sensemaking soll die Fähigkeit von Personen gestärkt werden, die Perspektive anderer Personen zu verstehen.;;CC-BY-NC-ND 4.0;https://www.civic-coding.de
https://www.civic-coding.de/community-information/projekte/vorschauseite-projekt/omos-online-migrationsberatung-ohne-sprachbarrieren/801;Online-Migrationsberatung ohne Sprachbarrieren;KI Anwendung, Übersetzungsassistent, Digitale Plattform, Entscheidungsassistent;Migration, Beratung;;Civic Coding;In Planung;Migrationsberatung ist ressourcenintensiv. Mit Hilfe des NLP-Frameworks Haystack wollen wir existente Datenbanken nutzen, um grundlegende Fragen zu beantworten und mit KI-basierten Machine Translations eine Echtzeit-Beratung mit Simultanübersetzungen den Aufwand minimieren.;OMoS;CC-BY-NC-ND 4.0;https://www.civic-coding.de
https://www.civic-coding.de/community-information/projekte/vorschauseite-projekt/ki-basierte-assistenz-fur-ein-aktiveres-und-eigenstaendigeres-leben-mit-diabetes/800;KI-basierte Assistenz für ein aktiveres und eigenständigeres Leben mit Diabetes.;Interaktive App, KI Anwendung, Analyse von Sensordaten und ML, Entscheidungsassistent;Gesundheit;;;In Planung;Eine App die Menschen mit insulinpflichtigem Diabetes beim Sport unterstützt. Durch die Kombination von medizinischen Leitlinien und Gesundheitssensoren, werden Tipps und Empfehlungen zum Sport erstellt. Mittels KI-basierten Datenanalysen werden die Inhalte dann personalisiert.;;CC-BY-NC-ND 4.0;https://www.civic-coding.de
https://www.civic-coding.de/community-information/projekte/vorschauseite-projekt/leed-ai-legal-education-ai/799;LeEd-AI (Legal Education AI);Generative KI, KI Anwendung;Wissensmanagement;https://www.civic-coding.de/community-information/projekte/vorschauseite-projekt/leed-ai-legal-education-ai/799;;In Planung;Grundgedanke ist es, einen hochschuldidaktischen Interventionsdesigner (=Lehre) zu entwickeln. Anhand von Kontextinformationen und Zielen soll ein Grobkonzept auf mittlerer Abstraktion didaktischen Handelns, ausgegeben werden. Dieses soll als Rahmen für die Detailplanung dienen.;LeEd-AI;CC-BY-NC-ND 4.0;https://www.civic-coding.de
https://www.civic-coding.de/community-information/projekte/vorschauseite-projekt/ki-lehrplattform/790;KI Lehrplattform;Digitale Plattform, KI Anwendung, Wissensmanagement, Datenanwendung für Öffentlichkeit;Bildung, Wissensmanagement;;Civic Coding;In Planung;Unsere Lehrplattform für KI-Bildung soll Lehrkräften leicht Zugang zu Materialien bieten, um KI-Wissen im Unterricht inhaltlich hochwertig zu vermitteln. Wir möchten Lehrkräfte unterstützen, guten Unterricht zu geben und Schüler:innen gute KI-Bildung ermöglichen.;;CC-BY-NC-ND 4.0;https://www.civic-coding.de
https://www.civic-coding.de/community-information/projekte/vorschauseite-projekt/mi4people-machine-intelligence-fur-das-gemeinwohl/786;MI4People - Machine Intelligence für das Gemeinwohl;KI Anwendung, Datenanalyse;Humanitäre Hilfe, Umweltschutz;;;In Weiterentwicklung;MI4People ist ein Netzwerk von hoch-qualifizierten Volontären, die KI- und Data-Science-Anwendungen erstellen, die dabei helfen humanitäre und ökologische Probleme unserer Welt zu lösen. Es soll als R&D Department für das Gemeinwohlsektor agieren.;MI4People;CC-BY-NC-ND 4.0;https://www.civic-coding.de
https://www.civic-coding.de/community-information/projekte/vorschauseite-projekt/feminist-ai-and-digital-policy-roundtable-eine-feministische-zukunftsvision/783;Feminist AI and Digital Policy Roundtable - eine feministische Zukunftsvision;KI Anwendung, Netzwerktool;Gleichstellung, Demokratie, Ethik, Frauen, Gleichberechtigung;https://www.civic-coding.de/community-information/projekte/vorschauseite-projekt/feminist-ai-and-digital-policy-roundtable-eine-feministische-zukunftsvision/783;;In Planung;"Die Vision einer feministischen Zukunft durch den Einsatz von KI und entsprechenden digitalpolitischen Leitlinien haben wir in den letzten sechs Monaten mit einer Reihe von relevanten Stakekolder:innen in unserem ""Feminist AI and Digital Policy Roundtable"" gestartet.";;CC-BY-NC-ND 4.0;https://www.civic-coding.de
https://www.civic-coding.de/community-information/projekte/vorschauseite-projekt/ki-basierte-burgerkommunikation-fur-soziales-und-oekologisches-loswerden-von-dingen/782;"KI-basierte Bürgerkommunikation für soziales und ökologisches ""Loswerden von Dingen""";KI Anwendung, Entscheidungsassistent, Chatbot;Umwelt, Nachhaltigkeit;;Civic Coding;In Planung;Es wird ein Bot konzipiert, der Nutzerinnen und Nutzer Entscheidungsoptionen aufzeigt, wie er/sie Dinge nachhaltig loswerden kann. Die Person gibt Informationen zum Objekt, Zustand und Ort und erhält auf Basis von KI sehr schnell sachlich formulierte Vorschläge.;;CC-BY-NC-ND 4.0;https://www.civic-coding.de
https://www.civic-coding.de/community-information/projekte/vorschauseite-projekt/blowi/781;BLOWI;Bericht, KI Anwendung, Datenanalyse;Wissensmanagement;;;Im Testbetrieb;Blog im Open-Access-Format als Möglichkeit der Wissenschaftskommunikation. Anschlussfähige Themen aus Gesellschaft und Wirtschaft mittels KI finden.;BLOWI;CC-BY-NC-ND 4.0;https://www.civic-coding.de
https://www.civic-coding.de/community-information/projekte/vorschauseite-projekt/ki-luftanalyse-von-schimmelsporen-pollen-und-anderen-gesundheitsschaedlichen-partikeln-einsetzbar-von-und-fur-jeden/778;KI - Luftanalyse von Schimmelsporen, Pollen und anderen gesundheitsschädlichen Partikeln, einsetzbar von und für Jeden.;Analyse von Sensordaten und ML, KI Anwendung, Datenerhebung;Gesundheit, Umweltschutz;;Onsite.ai;In Planung;Onsite.ai entwickelt eine automatisierte und KI-basierte Luftanalyse von Schimmelsporen, Pollen, Ruß und anderen potenziell gesundheitsschädlichen Partikeln. Dazu bauen wir tragbare Analysegeräte, die es jeder Person ermöglichen quantitative Luftanalysen selbst durchzuführen.;;CC-BY-NC-ND 4.0;https://www.civic-coding.de
https://www.civic-coding.de/community-information/projekte/vorschauseite-projekt/selbstmanagement-to-go-wie-ki-gestutzte-apps-menschen-mit-behinderung-am-uebergang-ausbildung-beruf-begleiten-koennen/776;"Selbstmanagement to go - wie KI-gestützte Apps Menschen mit Behinderung am Übergang ""Ausbildung-Beruf"" begleiten können";KI Anwendung, Interaktive App, Entscheidungsassistent, Ethik;Menschen mit Behinderung, Inklusion, Arbeit, Beratung, Ethik;;Civic Coding;In Weiterentwicklung;Eine bestehende App hat das Ziel Azubis mit Behinderung am Übergang „Ausbildung-Beruf” zu begleiten. Es wird ein Dialog mit der Zielgruppe aufgebaut, um ethische Aspekte von KI-Features für einen verantwortungsvollen Einsatz in der beruflichen Rehabilitation zu validieren.;;CC-BY-NC-ND 4.0;https://www.civic-coding.de
https://www.civic-coding.de/community-information/projekte/vorschauseite-projekt/aiapply-bewerbungsschreiben-leicht-gemacht/775;AiApply: Bewerbungsschreiben leicht gemacht;KI Anwendung, Generative KI, Entscheidungsassistent;Arbeit, Chancengleichheit;;;In Planung;"Ein Bewerbungsprozess ist zeitaufwändig, voller Stolpersteine und in Zeiten von ""Robo-Recruitern"" schwieriger denn je. AiApply unterstützt den Bürger dabei, in Rekordzeit eine erfolgreiche Bewerbung zu erstellen - maßgeschneidert auf eine vorhandene Stellenausschreibung.";AiApply;CC-BY-NC-ND 4.0;https://www.civic-coding.de
https://www.civic-coding.de/community-information/projekte/vorschauseite-projekt/coach2life/773;Coach2Life;KI Anwendung, Entscheidungsassistent;Gesundheit, Soziale Arbeit, Rehabilitation;https://www.civic-coding.de/community-information/projekte/vorschauseite-projekt/coach2life/773;Civic Coding;In Planung;Coach2Life ist ein KI-gestütztes Werkzeug zur quantitativen und qualitativen Verbesserung medizinischer und beruflicher Rehabilitationsprozesse sowie zur Kostenreduktion insbesondere im Sozialsystem.;;CC-BY-NC-ND 4.0;https://www.civic-coding.de
https://www.civic-coding.de/community-information/projekte/vorschauseite-projekt/ki-gestutzte-hybride-lehre/772;KI-gestützte Hybride Lehre;KI Anwendung, Automatisierte Datenübermittlung, Sprach-Editor, Dokumentations- und Netzwerktool;Wissensmanagement;https://www.civic-coding.de/community-information/projekte/vorschauseite-projekt/ki-gestutzte-hybride-lehre/772;Civic Coding;In Weiterentwicklung;Die Pandemie hat digitalen Lehre vorangebracht. Zurück in Vorlesungssälen gilt es nun beide Welten in einem hybriden Konzept zu vereinigen. KI kann helfen: Sprachgesteuerte Videokonferenzen, kontextbasierte Tools, automatische Protokollierung, … Möglich mit heutiger Technologie;;CC-BY-NC-ND 4.0;https://www.civic-coding.de
https://www.civic-coding.de/community-information/projekte/vorschauseite-projekt/ki-gerechte-lehre-und-evaluation/771;KI-Gerechte Lehre und Evaluation;Generative KI, KI Anwendung, Wissensmanagement, Datenanwendung für Öffentlichkeit;Ethik, Wissensmanagement;;Civic Coding;Unbekannt;"Hausarbeiten erledigen heute generative KIs wie ChatGPT; erste Unis verbieten den Gebrauch. Ist das der richtige Weg? Was wir brauchen sind Lernkonzepte, die den verantwortungsvollen Umgang mit diesen modernen Tools vermitteln, ohne den Lernerfolg von Lernenden zu opfern.";;CC-BY-NC-ND 4.0;https://www.civic-coding.de
https://www.civic-coding.de/community-information/projekte/vorschauseite-projekt/oer-lehrvideo-assistent/770;OER-Lehrvideo-Assistent;Generative KI, KI Anwendung, Large Language Model (LLM);Bildung;;Civic Coding;In Planung;Eine KI kann dabei unterstützen aus fertigen Materialien (u.a. Präsentationen) Lehrvideos zu erstellen. GPT erstellt aus Notizen einen Sprechertext. Aus diesem und den Folien wird ein Storyboard erstellt, das Nutzenden in der QA editiert. Text-To-Speech-KIs erstellen die Tonspur.;;CC-BY-NC-ND 4.0;https://www.civic-coding.de
https://www.civic-coding.de/community-information/projekte/vorschauseite-projekt/konstruktiver-zugang-zu-ki-im-bildungswesen/767;Konstruktiver Zugang zu KI im Bildungswesen;KI Anwendung, Digitale Plattform, Generative KI, Large Language Model (LLM), Interaktive App;Jugendarbeit, Wissensmanagement, Ethik;;Civic Coding;In Planung;Bei dem kooperativen Vorhaben soll der konstruktive Zugang zu und ein reflektierter Umgang mit aktuellen KI-Tools wie GPT-3 und-4 für das Bildungswesen ermöglicht werden. Vor allem SchülerInnen und LehrerInnen sollen eine geschützte Umgebung bereitgestellt bekommen.;;CC-BY-NC-ND 4.0;https://www.civic-coding.de
https://www.civic-coding.de/community-information/projekte/vorschauseite-projekt/diskriminierung-in-ki-erkennen-und-vermeiden/766;Diskriminierung in KI erkennen und vermeiden;KI Anwendung, Monitoring, Analyse von Sensordaten und ML;Antidiskriminierung, Ethik, Gleichberechtigung, Gleichstellung, Transparenz;https://www.civic-coding.de/community-information/projekte/vorschauseite-projekt/diskriminierung-in-ki-erkennen-und-vermeiden/766;Civic Coding, Bundesministerium für Arbeit und Soziales, Bundesministerium für Bildung, Familie, Senioren, Frauen und Jugend, Bundesministerium für Umwelt, Klimaschutz, Naturschutz und nukleare Sicherheit, Bundesministerium für Digitales und Staatsmodernisierung;In Weiterentwicklung;Wir begleiten die Einführung von KI mit dem Ziel einer möglichst diskriminierungsfreien Gestaltung. Gesucht: Partnerorganisation, die KI/ADM bereits einsetzt oder entwickelt. Wir bieten die sozio-technische Expertise für Diskriminierungserkennung und -vermeidung.;;CC-BY-NC-ND 4.0;https://www.civic-coding.de
https://www.civic-coding.de/community-information/projekte/vorschauseite-projekt/abracadabra/765;Abracadabra;Interaktive App, KI Anwendung, Prozessautomatisierung;Wissensmanagement;;;In Planung;Abracadabra ist ein interaktives Tool zum Erstellen von Angeboten, Kostenvoranschlägen und Verträgen bis zur Fertigstellung einer Rechnung. KI-basierte Starthilfe für Freiberufler. Optimiert für alle digitalen Berufe wie z.B. Designer, Entwickler, Übersetzer und Content Manager;;CC-BY-NC-ND 4.0;https://www.civic-coding.de
https://www.civic-coding.de/community-information/projekte/vorschauseite-projekt/mit-sensoren-und-ki-einfache-prototypen-entwickeln-ganz-ohne-it-faehigkeiten/764;Mit Sensoren und KI einfache Prototypen entwickeln, ganz ohne IT Fähigkeiten;Analyse von Sensordaten und ML, KI Anwendung, Datenerhebung, Digitale Plattform;Nachhaltigkeit, Umweltschutz;https://www.civic-coding.de/community-information/projekte/vorschauseite-projekt/mit-sensoren-und-ki-einfache-prototypen-entwickeln-ganz-ohne-it-faehigkeiten/764;Civic Coding;In Planung;Die Entwicklung nachhaltiger (low-Carb)-Geschäftsmodelle ist für KMU eine große Herausforderung. Die Kombination von Internet of Things (IoT), Umwelt-Sensorik (Air-Quality) und Künstliche Intelligenz (KI) ist dabei die elementare Basis für einen nachhaltigen und digitalen Wandel.;;CC-BY-NC-ND 4.0;https://www.civic-coding.de
https://www.civic-coding.de/community-information/projekte/vorschauseite-projekt/barrierefreie-informationen-end-to-end-auf-knopfdruck-inhalte-in-leichter-sprache-inklusive-bebilderung-erstellen/763;"Barrierefreie Informationen ""end to end"": Auf Knopfdruck Inhalte in Leichter Sprache inklusive Bebilderung erstellen";KI Anwendung, Generative KI, Übersetzungsassistent, Datenanwendung für Öffentlichkeit;Barrierefreiheit, Inklusion, Gleichberechtigung;https://www.civic-coding.de/community-information/projekte/vorschauseite-projekt/barrierefreie-informationen-end-to-end-auf-knopfdruck-inhalte-in-leichter-sprache-inklusive-bebilderung-erstellen/763;Civic Coding;In Planung;Leicht verständlicher Text ist nur ein Element von barrierefreien Inhalten in Leichter Sprache. Mit dazu gehört ebenfalls eine anschauliche Bebilderung! Diese wollen wir mithilfe von KI automatisieren, sodass Informationen für alle gleichberechtigt zugänglich sind.;;CC-BY-NC-ND 4.0;https://www.civic-coding.de
https://www.civic-coding.de/community-information/projekte/vorschauseite-projekt/tagged-ki-teilhabe-fur-menschen-mit-geistiger-behinderung-durch-ki-fur-ambient-assisted-living-resilienz-austausch/762;TAGGED-KI – Teilhabe für Menschen mit Geistiger Behinderung durch KI für Ambient Assisted Living, Resilienz, Austausch;KI Anwendung, Digitale Plattform, Entscheidungsassistent, Automatisierte Datenübermittlung;Menschen mit Behinderung, Teilhabe, Pflege, Gesundheit;https://www.civic-coding.de/community-information/projekte/vorschauseite-projekt/tagged-ki-teilhabe-fur-menschen-mit-geistiger-behinderung-durch-ki-fur-ambient-assisted-living-resilienz-austausch/762;Civic Coding;In Planung;Menschen mit geistiger Behinderung (Zielgr. 1) werden unterstützt, um tägliche Anforderungen sicherer zu meistern und stärker teilzuhaben. Betreuende (Zielgr. 2) werden entlastet und in ihrer Dokumentationspflicht unterstützt, sodass mehr Zeit für hochwertige Interaktion bleibt.;TAGGED-KI;CC-BY-NC-ND 4.0;https://www.civic-coding.de
https://www.civic-coding.de/community-information/projekte/vorschauseite-projekt/dementia-voicebot/760;Dementia VoiceBot;KI Anwendung, Large Language Model (LLM), Entscheidungsassistent, Interaktive App;Demenz, Senioren, Pflege, Pflegende Angehörige, Gesundheit, Mentale Gesundheit;;;In Planung;KI-basierter ChatBot zur Telefonkommunikation (VoiceBot) für die Anwendung bei Demenzkranken oder alleinstehenden älteren Menschen zur Entlastung von Angehörigen und Pflegepersonal mit dem Ziel den Krankheitsverlauf positiv zu beeinflussen.;;CC-BY-NC-ND 4.0;https://www.civic-coding.de
https://www.civic-coding.de/community-information/projekte/vorschauseite-projekt/ant-e-antisemitismus-erkennen-handy-app-fur-junge-menschen-zur-erkennung-von-antisemitismus-im-medienalltag/759;ANT-E: ANTISEMITISMUS ERKENNEN! Handy-App für junge Menschen zur Erkennung von Antisemitismus im Medienalltag;Interaktive App, KI Anwendung, Datenanalyse, Entscheidungsassistent;Antidiskriminierung, Antirassismus, Jugendarbeit;;Civic Coding;In Planung;Entwicklung eines KI-basierten Tools, das junge Menschen bild- sprach- und gaming-basiert dazu befähigt, antisemitische Kommunikationsinhalte und -Muster durch einen Selbsttest zu erkennen, zu reflektieren und sich dagegen stark zu machen.;ANT-E;CC-BY-NC-ND 4.0;https://www.civic-coding.de
https://www.civic-coding.de/community-information/projekte/vorschauseite-projekt/ki-leicht-gemacht-mit-dem-humanoiden-roboter-zum-selberbauen-ki-anwendungen-einfach-verstehen-und-selbst-anwenden/757;KI leicht gemacht - mit dem humanoiden Roboter zum Selberbauen KI-Anwendungen einfach verstehen und selbst anwenden;KI Anwendung;Jugendarbeit;;;In Planung;Mit Hilfe von pib, einem humanoiden Roboter zum Selberbauen, können Jugendliche durch ein neu konzipiertes KI-Modul spielend einfach KI verstehen lernen und selbst anwenden. Der Einsatz ist im Rahmen des Projektes pib@school an Schulen und Bildungseinrichtungen geplant.;;CC-BY-NC-ND 4.0;https://www.civic-coding.de
https://www.civic-coding.de/community-information/projekte/vorschauseite-projekt/automatisiert-lernendes-und-selbst-optimierendes-personal-vertretungsmanagement-system-inklusion-und-schulbegleitung/756;Automatisiert lernendes und selbst optimierendes Personal-Vertretungsmanagement-System (Inklusion und Schulbegleitung).;KI Anwendung, Prozessautomatisierung, Entscheidungsassistent;Inklusion, Verwaltung;;;In Planung;System für organisationsübergreifendes Personalvertretungsmanagement für die Schulbegleitung (im Rahmen von Inklusion) mit KI-basierten Algorithmen, welches Vertretungszuordnungen in Echtzeit als Entscheidungsgrundlage für das Vertretungsmanagement zur Verfügung stellt.;;CC-BY-NC-ND 4.0;https://www.civic-coding.de
https://www.civic-coding.de/community-information/projekte/vorschauseite-projekt/objekterkennung-zum-erkennen-und-warnen-vor-gefahren/754;Objekterkennung zum Erkennen und Warnen vor Gefahren;KI Anwendung, Analyse von Sensordaten und ML, Monitoring;Gesundheit;;Civic Coding;In Planung;Wir wollen ein KI-System entwickeln, welches Objekte in Bildern erkennt und kenntlich macht, ob z.B. -Personen FFP2-Masken tragen -Mitarbeiter persönliche Schutzausrüstung tragen (Baustellenhelme, Haarnetze in der Gastronomie, Sicherheitsbrillen);;CC-BY-NC-ND 4.0;https://www.civic-coding.de
