Quelle;Projektname;Art;Einsatzbereich;Webseite-Link;Organisation;Status;Kurzzusammenfassung;Projekt-Abkürzung;Lizenz;Lizenz-Organisation
https://codefor.de/projekte/flaechengerechtigkeit/;Flächengerechtigkeits-Tool;{'Datenanalyse': 'Datenanalyse', 'Datenanwendung für Öffentlichkeit': 'Datenanwendung für Öffentlichkeit', 'Interaktive Karte': 'Karten & Verzeichnisse', 'Visualisierung mit Karten': 'Karten & Verzeichnisse'};{'Stadt': 'Stadtentwicklung', 'Stadtplanung': 'Stadtentwicklung', 'Partizipation': 'Inklusionspolitik', 'Transparenz': 'Inklusionspolitik'};http://clevere-staedte.de/flaechen-gerechtigkeits-report-online;Code for Germany, Open Knowledge Foundation Deutschland e.V., OK Lab Berlin;In Betrieb;Das Flächengerechtigkeits-Tool ermöglicht es Bürgern, ihre Straßen zu vermessen und die Gerechtigkeit im Verkehr quadratmetergenau zu diskutieren.;;CC-BY 4.0;https://codefor.de/
https://codefor.de/projekte/flaechentool/;Flächentool;{'Datenanalyse': 'Datenanalyse', 'Karte': 'Karten & Verzeichnisse', 'Datenanwendung für Öffentlichkeit': 'Datenanwendung für Öffentlichkeit', 'Visualisierung mit Karten': 'Karten & Verzeichnisse'};{'Stadtplanung': 'Stadtentwicklung', 'Umwelt': 'Umweltschutz', 'Nachhaltigkeit': 'Umweltschutz', 'Offene Daten': 'Datenmanagement'};;Code for Germany, OK Lab Berlin, Open Knowledge Foundation Deutschland e.V.;In Betrieb;Das Flächentool berechnet die Nutzung von Flächen basierend auf OpenStreetMap (OSM) Daten. Es ist momentan auf Deutschland beschränkt und kann Ungenauigkeiten aufgrund fehlerhafter oder fehlender Daten aufweisen.;;CC-BY 4.0;https://codefor.de/
https://codefor.de/projekte/dd-freieparkplaetze/;Freie Parkplätze Dresden;{'Datenerhebung': 'Datenerhebung', 'Offene Daten': 'Öffentliche Daten', 'Digitale Plattform': 'Digitale Plattformen', 'Datenanalyse': 'Datenanalyse', 'Visualisierung': 'Datenreporting', 'Analyse von Sensordaten und ML': 'Künstliche Intelligenz', 'KI Anwendung': 'KI Anwendung', 'Interaktive App': 'Webanwendungen', 'Karte': 'Karten & Verzeichnisse', 'Visualisierung mit Karten': 'Karten & Verzeichnisse'};{'Stadt': 'Stadtentwicklung', 'Stadtplanung': 'Stadtentwicklung', 'Transparenz': 'Inklusionspolitik', 'Offene Daten': 'Datenmanagement'};https://ubahn.draco.uberspace.de/opendata/ui/, https://jkliemann.de/parkendd/, https://parkendd.kilian.io, https://mechlab-engineering.de/2015/03/vorhersage-der-parkhausbelegung-mit-offenen-daten/, https://ubahn.draco.uberspace.de/opendata/cached_api.php;Code for Germany, Stadt Dresden;In Betrieb;Das Projekt 'Freie Parkplätze Dresden' macht die ursprünglich nicht maschinenlesbaren Daten der Stadt Dresden zu freien Parkplätzen zugänglich. Es bietet eine maschinenlesbare Schnittstelle (API), eine Karte zur aktuellen Belegung sowie Smartphone-Apps und eine Vorhersage der Parkhausbelegung mittels Machine Learning.;ParkenDD;CC-BY 4.0;https://codefor.de/
https://codefor.de/projekte/ffpb-nodes/;Freifunk Knotenliste;{'Interaktive App': 'Webanwendungen', 'Karte': 'Karten & Verzeichnisse', 'Datenanwendung für Öffentlichkeit': 'Datenanwendung für Öffentlichkeit'};{'Vernetzung': 'Gesundheit und Soziales', 'Stadt': 'Stadtentwicklung', 'Offene Daten': 'Datenmanagement', 'Partizipation': 'Inklusionspolitik'};;Code for Germany, Open Knowledge Foundation Deutschland e.V., Code for Paderborn;In Weiterentwicklung;Die Freifunk Knotenliste ist der Beginn einer Companion App, die aktuell Freifunk-Knoten auflistet und deren Details anzeigt. Zukünftige Funktionen umfassen eine Kartenansicht für Paderborn und Benachrichtigungen bei Änderungen an Lieblingsknoten.;;CC-BY 4.0;https://codefor.de/
https://codefor.de/projekte/le-gentrifizierung/;Gebäude-Entwicklung in Leipzig;{'Datenerhebung': 'Datenerhebung', 'Datenanalyse': 'Datenanalyse', 'Visualisierung mit Karten': 'Karten & Verzeichnisse', 'Interaktive Karte': 'Karten & Verzeichnisse'};{'Stadt': 'Stadtentwicklung', 'Stadtplanung': 'Stadtentwicklung', 'Wohnen': 'Stadtentwicklung'};https://codeforleipzig.github.io/Gentrification/buildings.html;OK Lab Leipzig, Open Knowledge Foundation Deutschland e.V.;Eingestellt;Das Projekt dokumentiert und visualisiert die Gebäude-Entwicklung in Leipzig über die letzten Jahre anhand von OpenStreetMap-Daten und Luftbildaufnahmen. Es zeigt, wie sich das Stadtbild durch Schließung von Baulücken und Wachstum an den Rändern verändert hat.;;CC-BY 4.0;https://codefor.de/
https://codefor.de/projekte/gedenktafelnberlin/;Gedenktafeln in Berlin;{'Karte': 'Karten & Verzeichnisse', 'Datenanwendung für Öffentlichkeit': 'Datenanwendung für Öffentlichkeit'};{'Demokratie': 'Politische Freiheiten', 'Antidiskriminierung': 'Gegen Diskriminierung', 'Antirassismus': 'Gegen Diskriminierung', 'Menschenrechte': 'Soziale Rechte', 'Stadt': 'Stadtentwicklung'};;Code for Germany, OK Lab Berlin, Open Knowledge Foundation Deutschland e.V.;Unbekannt;"Das Projekt ""Gedenktafeln in Berlin"" ist eine Webseite, die vorhandene und auf Wunsch entfernte Gedenktafeln zu historischen Orten in Berlin anzeigt. Diese Tafeln erinnern an Menschen, die sich der nationalsozialistischen Diktatur widersetzten oder Opfer politischer beziehungsweise rassistischer Verfolgung wurden.";;CC-BY 4.0;https://codefor.de/
https://codefor.de/projekte/geodata-time/;Geodaten mit Zeitdimension;{'Datenbank': 'Datenmanagement', 'Datenanalyse': 'Datenanalyse', 'Datenerhebung': 'Datenerhebung', 'API': 'Datenmanagement'};{'Offene Daten': 'Datenmanagement', 'Wissensmanagement': 'Soziale Organisation', 'Datenanalyse': 'Datenmanagement'};;Open Knowledge Foundation Deutschland e.V., OK Lab Berlin;In Planung;Das Projekt zielt darauf ab, eine Datenbank zu entwickeln, die mehrere Versionen desselben Geodatensatzes speichern kann, um zeitliche Änderungen nachvollziehbar zu machen und den Zugriff auf verschiedene Snapshots per API zu ermöglichen.;;CC-BY 4.0;https://codefor.de/
https://codefor.de/projekte/bn-veranstaltungskalender/;Geographischer Veranstaltungskalender;{'Interaktive Karte': 'Karten & Verzeichnisse', 'Visualisierung mit Karten': 'Karten & Verzeichnisse', 'Datenanwendung für Öffentlichkeit': 'Datenanwendung für Öffentlichkeit', 'Datenerhebung': 'Datenerhebung'};{'Stadt': 'Stadtentwicklung', 'Partizipation': 'Inklusionspolitik'};;Code for Germany, Open Knowledge Foundation Deutschland e.V., OK Lab Bonn-Rhein-Sieg;In Weiterentwicklung;Ein geographischer Veranstaltungskalender für Bonn, der Veranstaltungen in einer Heatmap-ähnlichen Darstellung visualisieren soll. Das Projekt orientiert sich an einem ähnlichen Wiener Projekt.;;CC-BY 4.0;https://codefor.de/
https://codefor.de/projekte/hn-geojson-utilities/;Geojson Utilities;{'Datenerhebung': 'Datenerhebung', 'Datensatz und Visualisierung': 'Datenreporting', 'Offene Daten': 'Öffentliche Daten', 'Visualisierung mit Karten': 'Karten & Verzeichnisse'};{'Offene Daten': 'Datenmanagement', 'Stadtplanung': 'Stadtentwicklung'};http://opendatalab.de/projects/geojson-utilities/;Opendatalab, Code for Germany, Open Knowledge Foundation Deutschland e.V.;Eingestellt;Das Projekt ermöglicht den schnellen Export von Gemeindeflächen, Landkreis- und Bundeslandflächen in Deutschland im .geojson Format mit zusätzlichen Eigenschaften. Es dient Journalisten und Programmierern zur Erstellung von Visualisierungen auf Basis von Geodaten.;;CC-BY 4.0;https://codefor.de/
https://codefor.de/projekte/cologne-giesst/;GießtKölle;{'Interaktive Karte': 'Karten & Verzeichnisse', 'Datenanwendung für Öffentlichkeit': 'Datenanwendung für Öffentlichkeit', 'Crowd-Sourced Daten': 'Öffentliche Daten', 'Visualisierung mit Karten': 'Karten & Verzeichnisse'};{'Stadt': 'Stadtentwicklung', 'Umweltschutz': 'Umweltschutz', 'Partizipation': 'Inklusionspolitik'};https://giesst.koeln;Code for Germany, OK Lab Köln, Open Knowledge Foundation Deutschland e.V.;Eingestellt;GießtKölle ist eine interaktive Webkarte, die über den Wasserbedarf von Bäumen informiert. Nutzer können mitteilen, ob sie Bäume in ihrer Nachbarschaft gegossen haben.;;CC-BY 4.0;https://codefor.de/
https://codefor.de/projekte/le-glaeserne-klaeranlage/;Gläsernes Klärwerk;{'Visualisierung': 'Datenreporting', 'Interaktive App': 'Webanwendungen', 'Datenanalyse': 'Datenanalyse', 'Datensatz und Visualisierung': 'Datenreporting', 'Offene Daten': 'Öffentliche Daten'};{'Umwelt': 'Umweltschutz', 'Umweltschutz': 'Umweltschutz', 'Offene Daten': 'Datenmanagement'};https://codeforleipzig.github.io/glaeserne-klaeranlage/;OEWA, Gesellschaft für Informatik, OKLab Leipzig;Eingestellt;Das Projekt Gläsernes Klärwerk erstellt interaktive Visualisierungen über die Funktionsweise einer Kläranlage. Dafür wurden Betriebsdaten einer Kläranlage der OEWA für ein ganzes Jahr bereitgestellt, um die Daten öffentlich zugänglich zu machen.;;CC-BY 4.0;https://codefor.de/
https://codefor.de/projekte/grossstadtbaum/;Großstadt-Baum;{'Datenanalyse': 'Datenanalyse', 'Datensatz und Visualisierung': 'Datenreporting'};{'Stadt': 'Stadtentwicklung', 'Umwelt': 'Umweltschutz', 'Umweltschutz': 'Umweltschutz', 'Offene Daten': 'Datenmanagement'};http://www.tursics.de/story/grossstadt-baum/;Open Knowledge Foundation Deutschland e.V., OK Lab Berlin;Eingestellt;Das Projekt analysiert die von Berlin veröffentlichten Datensätze zu Anlagen-, Straßen- und Uferbäumen. Es sucht und identifiziert den typischen Berliner Baum aus über einer Million Datenpunkten.;;CC-BY 4.0;https://codefor.de/
https://codefor.de/projekte/c-haltestellen/;Haltestellen in Chemnitz & Umland;{'Karte': 'Karten & Verzeichnisse', 'Visualisierung mit Karten': 'Karten & Verzeichnisse', 'Datensatz und Visualisierung': 'Datenreporting', 'Offene Daten': 'Öffentliche Daten'};{'Stadt': 'Stadtentwicklung', 'Offene Daten': 'Datenmanagement', 'Stadtplanung': 'Stadtentwicklung'};;Code for Germany, OK Lab Chemnitz, Open Knowledge Foundation Deutschland e.V.;Eingestellt;Die Karte zeigt die von der CVAG zur Verfügung gestellten Haltestellendaten. Man sieht deutliche Abweichungen der Koordinaten zu den Punkten auf der OSM Karte.;;CC-BY 4.0;https://codefor.de/
https://codefor.de/projekte/hh-echtzeit/;Hamburg in Zahlen;{'Dashboard': 'Datenreporting', 'Datenvisualisierung': 'Datenreporting', 'Interaktive App': 'Webanwendungen'};{'Stadt': 'Stadtentwicklung', 'Transparenz': 'Inklusionspolitik', 'Offene Daten': 'Datenmanagement'};https://ndldd.github.io/echtzeit/app/#/;OK Lab Hamburg, Code for Germany, Open Knowledge Foundation Deutschland e.V.;In Betrieb;Dieses Projekt bietet eine Übersicht interessanter Zahlen, die zeigen, was sich gerade durchschnittlich in Hamburg verändert.;;CC-BY 4.0;https://codefor.de/
https://codefor.de/projekte/p-haushalt/;Haushalt Potsdam 2018/2019;{'Dashboard': 'Datenreporting', 'Visualisierung': 'Datenreporting', 'Offene Daten': 'Öffentliche Daten', 'Datenanwendung für Öffentlichkeit': 'Datenanwendung für Öffentlichkeit'};{'Stadt': 'Stadtentwicklung', 'Transparenz': 'Inklusionspolitik', 'Verwaltung': 'Soziale Organisation', 'Offene Daten': 'Datenmanagement', 'Partizipation': 'Inklusionspolitik'};https://offenerhaushalt.de/haushalt/BB/Potsdam/;OK Lab Potsdam, Open Knowledge Foundation Deutschland e.V.;Eingestellt;Das Projekt ermöglicht die interaktive Erkundung des Doppelhaushalts von Potsdam für die Jahre 2018 und 2019, um Finanzdaten zugänglich zu machen.;;CC-BY 4.0;https://codefor.de/
https://codefor.de/projekte/historic-berlin/;Historische Entwicklung Berlins;{'Karten': 'Karten & Verzeichnisse', 'Datensatz': 'Datenmanagement', 'Visualisierung': 'Datenreporting'};{'Stadt': 'Stadtentwicklung', 'Stadtplanung': 'Stadtentwicklung', 'Wissensmanagement': 'Soziale Organisation'};http://community.codefor.de/entwicklung-berlins/;Code for Germany, Open Knowledge Foundation Deutschland e.V., OK Lab Berlin;Unbekannt;Das Projekt stellt historische Berlin-Karten aus dem FIS-Broker bereit, um sie in anderen Projekten nutzen zu können. Es ermöglicht die Visualisierung der historischen Entwicklung der Stadt Berlin.;;CC-BY 4.0;https://codefor.de/
https://codefor.de/projekte/muc-ddj/;How-To Datenjournalismus;{'Dokumentations- und Netzwerktool': 'Unterstützungstools', 'Wissensmanagement': 'Wissensorganisation', 'Datenanalyse': 'Datenanalyse'};{'Wissensmanagement': 'Soziale Organisation', 'Demokratie': 'Politische Freiheiten', 'Transparenz': 'Inklusionspolitik'};http://howto.ddjdach.de;Code for Germany, Open Knowledge Foundation Deutschland e.V., OK Lab München;Eingestellt;Das Projekt bietet eine Anleitung und Ressourcen zum Thema Datenjournalismus. Es fungiert als Leitfaden für die Praxis des Datenjournalismus.;;CC-BY 4.0;https://codefor.de/
https://codefor.de/projekte/vortrag_bielefeld_io/;Innovationen durch Open Data bei der Bielefeld.IO 2021;{'Vortrag': 'Fortbildung', 'Workshop': 'Fortbildung', 'Offene Daten': 'Öffentliche Daten'};{'Offene Daten': 'Datenmanagement', 'Stadt': 'Stadtentwicklung', 'Transparenz': 'Inklusionspolitik'};https://www.eventbrite.de/e/bielefeld-io-2021-tickets-163043755261?aff=foundersfoundation, https://bielefeld.io/;Code for Germany, Open Knowledge Foundation Deutschland e.V.;Eingestellt;Dieses Projekt umfasste einen Vortrag und Workshop zum Thema „Innovationen durch Open Data“ im Rahmen der Bielefeld.IO 2021. Es vermittelte Einblicke in die Potenziale offener Daten.;;CC-BY 4.0;https://codefor.de/
https://codefor.de/projekte/le-intelligentes-rathaus/;Intelligentes Rathaus Leipzig;{'Datenanalyse': 'Datenanalyse', 'Monitoring': 'Wirkungsmessung', 'Datenerhebung': 'Datenerhebung', 'Knowledge Graph': 'Wissensorganisation', 'Offene Daten': 'Öffentliche Daten', 'Digitale Plattform': 'Digitale Plattformen', 'KI Anwendung': 'KI Anwendung'};{'Stadt': 'Stadtentwicklung', 'Verwaltung': 'Soziale Organisation', 'Partizipation': 'Inklusionspolitik', 'Transparenz': 'Inklusionspolitik', 'Demokratie': 'Politische Freiheiten', 'Offene Daten': 'Datenmanagement'};https://stadtratmonitor.codeforleipzig.de;Code for Germany, Code for Leipzig, Open Knowledge Foundation Deutschland e.V.;In Weiterentwicklung;Das Projekt ermöglicht die Volltextsuche im Ratsinformationssystem der Stadt Leipzig und das Abonnieren von Suchergebnissen. Es wird aktiv weiterentwickelt, um neue Features wie einen Wissensgraphen und maschinelles Lernen zu integrieren.;;CC-BY 4.0;https://codefor.de/
https://codefor.de/projekte/fl-open-biotope-map/;Interaktive Biotopkarte mit Wertbiotopen und Nichtwertbiotopen;{'Interaktive Karte': 'Karten & Verzeichnisse', 'Visualisierung mit Karten': 'Karten & Verzeichnisse', 'Datenanalyse': 'Datenanalyse', 'Datenanwendung für Öffentlichkeit': 'Datenanwendung für Öffentlichkeit'};{'Umweltschutz': 'Umweltschutz', 'Umwelt': 'Umweltschutz', 'Nachhaltigkeit': 'Umweltschutz', 'Offene Daten': 'Datenmanagement'};https://biotopkarte.oklabflensburg.de;OK Lab Flensburg, Code for Germany, Open Knowledge Foundation Deutschland e.V.;In Weiterentwicklung;Das Projekt ist eine interaktive Biotopkarte, die die Vielfalt der Biotope in Schleswig-Holstein digital erkundbar macht. Sie visualisiert Wertbiotope und Nichtwertbiotope basierend auf offenen Daten des Landesamts für Umwelt.;;CC-BY 4.0;https://codefor.de/
https://codefor.de/projekte/fl-open-parcel-map/;Interaktive Flurstücksauskunft für Schleswig-Holstein;{'Interaktive Karte': 'Karten & Verzeichnisse', 'Offene Daten': 'Öffentliche Daten', 'Datenanwendung für Öffentlichkeit': 'Datenanwendung für Öffentlichkeit', 'Visualisierung mit Karten': 'Karten & Verzeichnisse'};{'Offene Daten': 'Datenmanagement', 'Verwaltung': 'Soziale Organisation', 'Stadtplanung': 'Stadtentwicklung', 'Transparenz': 'Inklusionspolitik'};https://flurstuecksauskunft.oklabflensburg.de;OK Lab Flensburg, Code for Germany;In Weiterentwicklung;Das Projekt bietet eine interaktive, nicht amtliche Flurstücksauskunft für Schleswig-Holstein, um Verwaltungs-, Kreis-, Gemeindegrenzen, Gemarkungen und Flurstücke digital zugänglich zu machen. Es basiert auf ALKIS-Daten und richtet sich an Bürgerinitiativen und die Öffentlichkeit.;;CC-BY 4.0;https://codefor.de/
https://codefor.de/projekte/interessante-orte/;Interessante Orte;{'Kartenanwendung': 'Karten & Verzeichnisse', 'Visualisierung mit Karten': 'Karten & Verzeichnisse', 'Datenanwendung für Öffentlichkeit': 'Datenanwendung für Öffentlichkeit'};{'Stadt': 'Stadtentwicklung', 'Wissensmanagement': 'Soziale Organisation'};https://cologne.codefor.de/koeln_muelheim_ns_zeit/index.html;Code for Köln, Geschichtswerkstatt Köln Mülheim;Eingestellt;Das Projekt bietet eine Anleitung, um eine einfache Kartenanwendung zu erstellen, mit der interessante Orte visualisiert werden können, ohne dass Programmierkenntnisse erforderlich sind.;;CC-BY 4.0;https://codefor.de/
https://codefor.de/projekte/le-schulinternet/;Internetgeschwindigkeit in Sachsens Schulen;{'Datenanalyse': 'Datenanalyse', 'Interaktive Karte': 'Karten & Verzeichnisse', 'Visualisierung mit Karten': 'Karten & Verzeichnisse'};{'Bildung': 'Bildungsberatung', 'Stadtplanung': 'Stadtentwicklung', 'Offene Daten': 'Datenmanagement'};;OK Lab Leipzig, Open Knowledge Foundation Deutschland e.V.;Eingestellt;Das Projekt stellt die Internetverbindungen von Schulen in Sachsen auf einer Karte dar, um den Breitbandausbau im Bildungssektor anzuregen. Es nutzt Daten aus verschiedenen Quellen und visualisiert diese mit Leaflet.js.;;CC-BY 4.0;https://codefor.de/
https://codefor.de/projekte/jedeschule-2/;jedeschule.de;{'Datenerhebung': 'Datenerhebung', 'Digitale Plattform': 'Digitale Plattformen', 'Automatisierte Datenübermittlung': 'Datenmanagement', 'Offene Daten': 'Öffentliche Daten', 'Datenstandards': 'Datenmanagement', 'Datensatz und Visualisierung': 'Datenreporting', 'Datenanwendung für Öffentlichkeit': 'Datenanwendung für Öffentlichkeit'};{'Offene Daten': 'Datenmanagement', 'Wissensmanagement': 'Soziale Organisation'};https://jedeschule.de/, https://jedeschule.codefor.de/docs, https://jedeschule.codefor.de/csv-data/;Open Knowledge Foundation Deutschland e.V., BildungsCent e.V.;In Betrieb;jedeschule.de sammelt alle Schuldaten Deutschlands auf einer Plattform. Das Projekt stellt eine zentrale API und wöchentliche CSV-Dumps der Schuldaten bereit, die durch individuelle Webscraper aktualisiert werden.;;CC-BY 4.0;https://codefor.de/
https://codefor.de/projekte/baustellen-chemnitz/;Karte Chemnitzer Baustellen;{'Karte': 'Karten & Verzeichnisse', 'Visualisierung mit Karten': 'Karten & Verzeichnisse', 'Offene Daten': 'Öffentliche Daten', 'Datenanwendung für Öffentlichkeit': 'Datenanwendung für Öffentlichkeit'};{'Stadt': 'Stadtentwicklung', 'Stadtplanung': 'Stadtentwicklung', 'Transparenz': 'Inklusionspolitik', 'Offene Daten': 'Datenmanagement'};http://morrisjobke.de/stuff/baustellen-chemnitz/;Code for Germany, OK Lab Chemnitz, Stadt Chemnitz;Eingestellt;Auf einer Karte werden die Baustellen in Chemnitz übersichtlich dargestellt. Die Daten werden von der Stadt Chemnitz als Text veröffentlicht.;;CC-BY 4.0;https://codefor.de/
https://codefor.de/projekte/blitzerkarte-chemnitz/;Karte Chemnitzer Blitzer;{'Karte': 'Karten & Verzeichnisse', 'Visualisierung mit Karten': 'Karten & Verzeichnisse', 'Datenanwendung für Öffentlichkeit': 'Datenanwendung für Öffentlichkeit', 'Offene Daten': 'Öffentliche Daten', 'Datenanalyse': 'Datenanalyse'};{'Stadt': 'Stadtentwicklung', 'Transparenz': 'Inklusionspolitik', 'Offene Daten': 'Datenmanagement', 'Verwaltung': 'Soziale Organisation'};http://morrisjobke.cartodb.com/viz/00030762-7ce5-11e4-9b32-0e4fddd5de28/public_map;Code for Germany, OK Lab Chemnitz, Open Knowledge Foundation Deutschland e.V.;In Betrieb;Das Projekt stellt monatlich von der Stadt Chemnitz veröffentlichte Geschwindigkeitskontrollen übersichtlich auf einer interaktiven Karte dar.;;CC-BY 4.0;https://codefor.de/
https://codefor.de/projekte/bn-opendatamap-nrw/;Karte der Open Data – Angebote in NRW;{'Karte': 'Karten & Verzeichnisse', 'Visualisierung mit Karten': 'Karten & Verzeichnisse', 'Offene Daten': 'Öffentliche Daten'};{'Offene Daten': 'Datenmanagement', 'Verwaltung': 'Soziale Organisation'};http://data.paderta.com/OpenData-NRW-Map/;Code for Germany, OK Lab Bonn-Rhein-Sieg, Open Knowledge Foundation Deutschland e.V.;Eingestellt;Die Karte bietet eine Übersicht über alle aktuellen kommunalen Open Data-Angebote in Nordrhein-Westfalen. Sie zeigt, welche Kommunen ein Open Data-Portal besitzen, welches System oder Lizenz sie verwenden und ob eine Anbindung an das Open.NRW-Portal besteht.;;CC-BY 4.0;https://codefor.de/
https://codefor.de/projekte/fl-open-recycling-map/;Karte der Recyclingcontainer in Flensburg;{'Karte': 'Karten & Verzeichnisse', 'Visualisierung mit Karten': 'Karten & Verzeichnisse', 'Offene Daten': 'Öffentliche Daten', 'Datenanwendung für Öffentlichkeit': 'Datenanwendung für Öffentlichkeit', 'Datenerhebung': 'Datenerhebung'};{'Umweltschutz': 'Umweltschutz', 'Stadt': 'Stadtentwicklung', 'Nachhaltigkeit': 'Umweltschutz', 'Offene Daten': 'Datenmanagement'};https://recycling.oklabflensburg.de;Technisches Betriebszentrum Flensburg AöR, OK Lab Flensburg, Open Knowledge Foundation Deutschland e.V.;In Weiterentwicklung;Eine interaktive Karte, die Standorte von Recyclingcontainern für Altkleidung und Altglas in Flensburg anzeigt, bereitgestellt vom Technisches Betriebszentrum Flensburg AöR. Ziel ist die Erweiterung um weitere Standorte und Anbieterdaten.;;CC-BY 4.0;https://codefor.de/
https://codefor.de/projekte/fl-open-cultural-map/;Karte mit Veranstaltungsorten der Kulturnacht Flensburg;{'Karte': 'Karten & Verzeichnisse', 'Visualisierung mit Karten': 'Karten & Verzeichnisse', 'Datenanwendung für Öffentlichkeit': 'Datenanwendung für Öffentlichkeit'};{'Stadt': 'Stadtentwicklung', 'Kultur': 'Internationale Beziehungen', 'Partizipation': 'Inklusionspolitik'};https://knf.grain.one;OK Lab Flensburg, Code for Germany;Eingestellt;Das Projekt hat eine spezielle digitale Karte für die Flensburger Kulturnacht entwickelt, um die verschiedenen kulturellen Orte und Veranstaltungen in der Stadt sichtbar zu machen. Kulturelle Einrichtungen und Initiativen konnten so ihre Vielfalt präsentieren.;;CC-BY 4.0;https://codefor.de/
https://codefor.de/projekte/wpt-kartenkarte/;KartenKarte;{'Karte': 'Karten & Verzeichnisse', 'Visualisierung mit Karten': 'Karten & Verzeichnisse', 'Datenanalyse': 'Datenanalyse', 'Datenerhebung': 'Datenerhebung', 'Offene Daten': 'Öffentliche Daten'};{'Offene Daten': 'Datenmanagement', 'Stadt': 'Stadtentwicklung', 'Transparenz': 'Inklusionspolitik', 'Wissensmanagement': 'Soziale Organisation'};http://kartenkarte.org;Code for Germany, Open Knowledge Foundation Deutschland e.V.;In Weiterentwicklung;KartenKarte liest vorhandene Daten aus OpenStreetMap aus und stellt diese auf eine besondere Art und Weise dar. Es hebt bestimmte Orte hervor und macht so Informationen sichtbar, die in Standard-Karten oft nicht gerendert werden.;;CC-BY 4.0;https://codefor.de/
https://codefor.de/projekte/hn-kastanienapp/;Kastanienapp;{'Interaktive App': 'Webanwendungen', 'Offene Daten': 'Öffentliche Daten', 'Visualisierung mit Karten': 'Karten & Verzeichnisse'};{'Umwelt': 'Umweltschutz', 'Stadt': 'Stadtentwicklung', 'Offene Daten': 'Datenmanagement'};http://blog.opendatalab.de/opendata/2014/11/19/kastanien-app-mit-baumkataster;Code for Heilbronn, Code for Germany, Open Knowledge Foundation Deutschland e.V.;Eingestellt;Die Kastanienapp ist eine mobile Anwendung, die auf den offenen Baumkatasterdaten der Stadt Hamburg basiert. Sie ermöglicht es Nutzern, unterwegs Kastanienbäume leicht zu finden und allgemeine Informationen zu Bäumen in Heilbronn abzufragen.;;CC-BY 4.0;https://codefor.de/
https://codefor.de/projekte/berlin-lichtenberg/;Kiez-Karte Berlin;{'Interaktive Karte': 'Karten & Verzeichnisse', 'Offene Daten': 'Öffentliche Daten', 'Datenanwendung für Öffentlichkeit': 'Datenanwendung für Öffentlichkeit', 'Visualisierung mit Karten': 'Karten & Verzeichnisse'};{'Offene Daten': 'Datenmanagement', 'Partizipation': 'Inklusionspolitik', 'Stadt': 'Stadtentwicklung', 'Stadtplanung': 'Stadtentwicklung', 'Demokratie': 'Politische Freiheiten'};http://kiez-karte.berlin;Code for Germany, Open Knowledge Foundation Deutschland e.V., OK Lab Berlin;In Weiterentwicklung;Die Kiez-Karte Berlin visualisiert offene Daten aus Berlin auf einer interaktiven Karte. Sie soll Bürgerbeteiligungsmöglichkeiten einbinden und städtische Informationen bürgernah darstellen.;;CC-BY 4.0;https://codefor.de/
https://codefor.de/projekte/le-kieznotiz/;KiezNotiz Leipziger Osten;{'Dashboard': 'Datenreporting', 'Karte': 'Karten & Verzeichnisse', 'Datenvisualisierung': 'Datenreporting', 'Datenanalyse': 'Datenanalyse', 'Offene Daten': 'Öffentliche Daten', 'Datenanwendung für Öffentlichkeit': 'Datenanwendung für Öffentlichkeit'};{'Stadt': 'Stadtentwicklung', 'Stadtplanung': 'Stadtentwicklung', 'Umwelt': 'Umweltschutz', 'Nachhaltigkeit': 'Umweltschutz', 'Partizipation': 'Inklusionspolitik', 'Offene Daten': 'Datenmanagement'};https://kieznotiz.codeforleipzig.de/, https://leipziger-ecken.de/, https://gtfs.codeforleipzig.de/;Leipziger, FabLab Leipzig, Studio Johey, OK Lab Leipzig, Open Knowledge Foundation Deutschland e.V.;Eingestellt;KiezNotiz Leipziger Osten ist eine Stadtteilplattform, die in einem Schaufenster Akteure und aktuelle Veranstaltungen in den Stadtteilen Neustadt-Neuschönefeld und Volkmarsdorf präsentiert. Sie nutzt ein Grafana-Dashboard und Karten zur Visualisierung von Daten, inklusive Luftqualitätsmessungen, und ist als Wissenschaftsladen konzipiert.;;CC-BY 4.0;https://codefor.de/
