Quelle;Projektname;Art;Einsatzbereich;Webseite-Link;Organisation;Status;Kurzzusammenfassung;Projekt-Abkürzung;Lizenz;Lizenz-Organisation
https://codefor.de/projekte/hh-bruecken/;Wie viele Brücken hat Hamburg?;{'Datenanalyse': 'Datenanalyse', 'Datenerhebung': 'Datenerhebung', 'Datenanwendung für Öffentlichkeit': 'Datenanwendung für Öffentlichkeit'};{'Stadt': 'Stadtentwicklung', 'Offene Daten': 'Datenmanagement'};http://hathamburgmehrbrueckenalsvenedig.tumblr.com/;Code for Germany, OK Lab Hamburg, Open Knowledge Foundation Deutschland e.V.;Eingestellt;Das Projekt untersucht kritisch die offizielle Angabe der Brückenanzahl in Hamburg. Es analysiert Brückendaten, insbesondere solche über Wasser, um zu überprüfen, ob Hamburg wirklich die brückenreichste Stadt Europas ist.;;CC-BY 4.0;https://codefor.de/
https://codefor.de/projekte/le-woistmarkt/;Wo ist Markt?;{'Interaktive Karte': 'Karten & Verzeichnisse', 'Datenanwendung für Öffentlichkeit': 'Datenanwendung für Öffentlichkeit', 'Visualisierung mit Karten': 'Karten & Verzeichnisse'};{'Stadt': 'Stadtentwicklung', 'Offene Daten': 'Datenmanagement'};http://wo-ist-markt.de/#leipzig;Code for Germany, OK Lab Leipzig;Eingestellt;Das Projekt „Wo ist Markt?“ zeigt die aktuellen Wochenmärkte in Leipzig auf einer interaktiven Karte an, mit der Möglichkeit nach dem aktuellen Tag zu filtern. Die Daten werden über eine JSON-Datei bereitgestellt und es gibt einen Scraper für die Leipziger Behörden-Seite.;;CC-BY 4.0;https://codefor.de/
https://codefor.de/projekte/be-woistmarkt/;Wo ist Markt?;{'Karte': 'Karten & Verzeichnisse', 'Visualisierung mit Karten': 'Karten & Verzeichnisse', 'Datenerhebung': 'Datenerhebung', 'Datenanwendung für Öffentlichkeit': 'Datenanwendung für Öffentlichkeit', 'Offene Daten': 'Öffentliche Daten', 'Automatisierte Datenübermittlung': 'Datenmanagement'};{'Stadt': 'Stadtentwicklung', 'Offene Daten': 'Datenmanagement'};http://wo-ist-markt.de;Code for Germany, OK Lab Berlin, Open Knowledge Foundation Deutschland e.V.;Eingestellt;Das Projekt visualisiert auf einer Karte, wo Wochen-, Floh- oder Gemüsemärkte stattfinden. Es nutzt Daten aus Open-Data-Portalen, um Nutzern Detailinformationen zu Marktzeiten und -orten anzuzeigen.;;CC-BY 4.0;https://codefor.de/
https://codefor.de/projekte/wo-ist-testzentrum/;Wo ist Testzentrum?;{'Karte': 'Karten & Verzeichnisse', 'Datenanwendung für Öffentlichkeit': 'Datenanwendung für Öffentlichkeit', 'Visualisierung mit Karten': 'Karten & Verzeichnisse'};{'Gesundheit': 'Psychische Gesundheit', 'Stadt': 'Stadtentwicklung'};https://wo-ist-testzentrum.de;Code for Germany, OK Lab Leipzig, Open Knowledge Foundation Deutschland e.V.;Eingestellt;Das Projekt zeigt auf einer interaktiven Karte die Standorte von Corona-Testzentren in verschiedenen deutschen Städten und Gemeinden an. Durch Anklicken der Pins erhalten Nutzer Informationen zu Öffnungszeiten und weiteren Details.;;CC-BY 4.0;https://codefor.de/
https://codefor.de/projekte/le-weihnachtsmarktkarte/;Wo ist Weihnachtsmarkt?;{'Interaktive Karte': 'Karten & Verzeichnisse', 'Offene Daten': 'Öffentliche Daten', 'Visualisierung mit Karten': 'Karten & Verzeichnisse', 'Datenerhebung': 'Datenerhebung'};{'Stadt': 'Stadtentwicklung', 'Offene Daten': 'Datenmanagement'};https://wo-ist-weihnachtsmarkt.codeforleipzig.de/;OK Lab Leipzig, Open Knowledge Foundation Deutschland e.V.;Eingestellt;Diese Webseite informiert über Weihnachtsmärkte in Leipzig und der näheren Umgebung. Sie nutzt offene Daten der Stadt Leipzig sowie weitere Quellen für die Anzeige der Märkte und deren Geolokalisierung und ÖPNV-Anbindung.;;CC-BY 4.0;https://codefor.de/
https://codefor.de/projekte/be-schulsanierung/;Wo unsere Kinder lernen;{'Interaktive Karte': 'Karten & Verzeichnisse', 'Datenvisualisierung': 'Datenreporting', 'Datenanalyse': 'Datenanalyse'};{'Stadt': 'Stadtentwicklung', 'Transparenz': 'Inklusionspolitik', 'Bildung': 'Bildungsberatung'};http://schulsanierung.tursics.de;Code for Germany, OK Lab Berlin, Open Knowledge Foundation Deutschland e.V.;Eingestellt;Dieses Projekt visualisiert auf einer interaktiven Karte den Sanierungsstau Berliner Schulen und die damit verbundenen Kosten. Es zeigt den Zustand vieler maroder Schulgebäude in der Stadt.;;CC-BY 4.0;https://codefor.de/
https://codefor.de/projekte/zug-direktverbindungen/;Zug-Direktverbindungen;{'Karte': 'Karten & Verzeichnisse', 'Visualisierung mit Karten': 'Karten & Verzeichnisse', 'Datenanwendung für Öffentlichkeit': 'Datenanwendung für Öffentlichkeit'};{'Stadt': 'Stadtentwicklung', 'Offene Daten': 'Datenmanagement'};https://direkt.bahn.guru;OK Lab Berlin, Open Knowledge Foundation Deutschland e.V.;Eingestellt;Das Projekt zeigt eine interaktive Karte mit allen Zug-Direktverbindungen, die von einer bestimmten Stadt aus erreichbar sind.;;CC-BY 4.0;https://codefor.de/
https://codefor.de/projekte/zuwendungen/;Zuwendungsdatenbank;{'Datenerhebung': 'Datenerhebung', 'Datenanalyse': 'Datenanalyse', 'Datenanwendung für Öffentlichkeit': 'Datenanwendung für Öffentlichkeit', 'Offene Daten': 'Öffentliche Daten'};{'Transparenz': 'Inklusionspolitik', 'Offene Daten': 'Datenmanagement', 'Verwaltung': 'Soziale Organisation', 'Demokratie': 'Politische Freiheiten'};http://zuwendungen.net/;Code for Germany, Open Knowledge Foundation Deutschland e.V.;Eingestellt;Die Zuwendungsdatenbank sammelt länderübergreifend frei zugängliche Daten über Zuwendungen, überführt diese in ein einheitliches Format und macht sie durchsuchbar.;;CC-BY 4.0;https://codefor.de/
https://correlaid.org//daten-nutzen/projektdatenbank/2025-05-CAS;Automatisierung von Reportings aus Evaluationsdaten;{'Reporting': 'Datenreporting', 'Visualisierung': 'Datenreporting', 'Automatisierte Datenübermittlung': 'Datenmanagement', 'Wirkungsmessung': 'Wirkungsmessung', 'Umfrage': 'Datenerhebung', 'Datenanalyse': 'Datenanalyse'};{'Bildung': 'Bildungsberatung', 'Kinder- und Jugendhilfe': 'Jugendhilfe', 'Chancengleichheit': 'Geschlechtergerechtigkeit'};https://www.coachatschool.org/;coach@school e.V., CorrelAid;In Planung;Das Projekt unterstützt coach@school dabei, Umfragedaten besser zu nutzen und wiederkehrende Arbeitsabläufe bei der Erstellung von Reportings zu automatisieren. Ziel ist die Optimierung von Berichten für Förderer durch ansprechende Datenvisualisierungen und die Befähigung der Organisation zur eigenständigen Pflege der Berichte.;;CC-BY 4.0;https://correlaid.org/
https://correlaid.org//daten-nutzen/projektdatenbank/2025-05-SIL;Improving and upgrading the Silbernetz dashboard;{'Dashboard': 'Datenreporting', 'Reporting': 'Datenreporting', 'Visualisierung mit Karten': 'Karten & Verzeichnisse', 'Datenanalyse': 'Datenanalyse', 'Prozessautomatisierung': 'Automatisierung', 'Interne Datenanwendung': 'Interne Datenanwendung'};{'Senioren': 'Altershilfe', 'Wohlfahrt': 'Soziale Hilfe', 'Wirkungsmessung': 'Gesundheit und Soziales', 'Transparenz': 'Inklusionspolitik'};https://www.silbernetz.org;CorrelAid, Silbernetz e.V.;In Planung;Dieses Projekt aktualisiert und verbessert das bestehende Shiny-Dashboard für Silbernetz e.V., um dessen Langlebigkeit, Stabilität und Leistung zu sichern. Es beinhaltet die Aktualisierung des Codes, die Verbesserung des Bereitstellungsprozesses und das Hinzufügen neuer Funktionen.;;CC-BY 4.0;https://correlaid.org/
https://correlaid.org//daten-nutzen/projektdatenbank/2024-12-SIN;Automatisiertes Qualitätsmanagement für ein Mentoringprogramm;{'Prozessautomatisierung': 'Automatisierung', 'Datenerhebung': 'Datenerhebung', 'Datenanalyse': 'Datenanalyse', 'Dashboard': 'Datenreporting', 'Reporting': 'Datenreporting', 'Visualisierung': 'Datenreporting'};{'Mentoring': 'Bildungsberatung', 'Jugendarbeit': 'Jugendhilfe', 'Chancengleichheit': 'Geschlechtergerechtigkeit', 'Evaluation': 'Gesundheit und Soziales'};https://www.sindbad.co.at/;Sindbad, CorrelAid;In Planung;Dieses Projekt zielt darauf ab, das interne Qualitätsmanagement für das Mentoringprogramm von Sindbad zu automatisieren. Es sollen Umfragedaten von Mentees und Mentor*innen ausgewertet und in einem anpassbaren Dashboard bereitgestellt werden, um die Ressourceneffizienz zu steigern und die Qualitätssicherung zu verbessern.;;CC-BY 4.0;https://correlaid.org/
https://correlaid.org//daten-nutzen/projektdatenbank/2025-01-SGC;Data Story mit Konstanzer Klima- und Wetterdaten;{'Bericht': 'Datenreporting', 'Visualisierung': 'Datenreporting', 'Datenanalyse': 'Datenanalyse', 'Datenanwendung für Öffentlichkeit': 'Datenanwendung für Öffentlichkeit', 'Offene Daten': 'Öffentliche Daten', 'Digitale Plattform': 'Digitale Plattformen'};{'Umweltschutz': 'Umweltschutz', 'Nachhaltigkeit': 'Umweltschutz', 'Stadt': 'Stadtentwicklung', 'Transparenz': 'Inklusionspolitik', 'Offene Daten': 'Datenmanagement', 'Demokratie': 'Politische Freiheiten'};https://smart-green-city-konstanz.de/, https://smart-green-city-konstanz.de/klimadatenplattform;CorrelAid, Smart Green City Konstanz;In Planung;Das Projekt entwickelt eine Data Story, die Bürger*innen in Konstanz die Folgen des Klimawandels anhand offener Klima- und Wetterdaten anschaulich vermittelt. Es fördert Transparenz und evidenzbasierte Entscheidungen und ist als Open-Source-Lösung für andere Kommunen übertragbar.;;CC-BY 4.0;https://correlaid.org/
https://correlaid.org//daten-nutzen/projektdatenbank/2024-09-CHW;Automatisiertes Monitoring der Zielgruppenentwicklung im Zeitverlauf;{'Reporting': 'Datenreporting', 'Visualisierung': 'Datenreporting', 'Automatisierung': 'Automatisierung', 'Wirkungsmessung': 'Wirkungsmessung', 'Datenanalyse': 'Datenanalyse', 'Datenauswertung': 'Datenanalyse', 'Umfrage': 'Datenerhebung'};{'Bildung': 'Bildungsberatung', 'Kinder- und Jugendhilfe': 'Jugendhilfe', 'Wirkungsmessung': 'Gesundheit und Soziales', 'Soziale Arbeit': 'Soziale Organisation'};https://chancenwerk.de/;CorrelAid, Chancenwerk e.V.;In Planung;Das Projekt unterstützt Chancenwerk e.V. dabei, das Potenzial ihrer Evaluationsdaten besser auszuschöpfen. Es automatisiert die Erstellung von Reports und Visualisierungen zur Entwicklung von Kindern und Jugendlichen im Zeitverlauf, um mehr Zeit für die direkte Arbeit mit ihnen zu ermöglichen.;;CC-BY 4.0;https://correlaid.org/
https://correlaid.org//daten-nutzen/projektdatenbank/2024-03-PZA;Open Data aus Bürger- und Jugendbeteiligungsprojekten;{'Datenerhebung': 'Datenerhebung', 'Datenanwendung für Öffentlichkeit': 'Datenanwendung für Öffentlichkeit', 'Offene Daten': 'Öffentliche Daten', 'Datensatz': 'Datenmanagement'};{'Demokratie': 'Politische Freiheiten', 'Jugendbeteiligung': 'Jugendhilfe', 'Partizipation': 'Inklusionspolitik', 'Offene Daten': 'Datenmanagement', 'Politische Bildung': 'Bildungsberatung'};https://civic-data.de/kommuki-open-data/;CorrelAid, Politik zum Anfassen e.V., Civic Data Lab;Eingestellt;Dieses Projekt machte Open Data aus Bürger- und Jugendbeteiligungsprojekten öffentlich zugänglich. Es wurde von CorrelAid im Rahmen des Civic Data Labs konzipiert und umgesetzt.;;CC-BY 4.0;https://correlaid.org/
https://correlaid.org//daten-nutzen/projektdatenbank/2024-06-BAB;Automatisierte Fragebogenauswertung mit Generativer KI;{'Generative KI': 'Künstliche Intelligenz', 'KI Anwendung': 'KI Anwendung', 'Large Language Model (LLM)': 'Sprachtechnologie', 'Umfrage': 'Datenerhebung', 'Datenanalyse': 'Datenanalyse', 'Prozessautomatisierung': 'Automatisierung', 'Reporting': 'Datenreporting', 'Monitoring': 'Wirkungsmessung', 'Entscheidungsassistent': 'Virtuelle Assistenz'};{'Arbeit mit Kindern': 'Jugendhilfe', 'Kinder- und Jugendhilfe': 'Jugendhilfe', 'Stadt': 'Stadtentwicklung', 'Stadtplanung': 'Stadtentwicklung', 'Barrierefreiheit': 'Inklusionspolitik'};;Babylotse Frankfurt, Kinderschutzbund Bezirksverband Frankfurt am Main, CorrelAid e.V.;In Weiterentwicklung;Dieses Projekt nutzte Generative KI und Large Language Models, um circa 1000 offene Antworten einer Umfrage von Familien mit Babys in Frankfurt automatisiert auszuwerten. Die Ergebnisse wurden städtischen Entscheidungsträgern präsentiert, um die Familienfreundlichkeit in Frankfurt zu verbessern, und das Projekt soll wiederholt und ausgebaut werden.;;CC-BY 4.0;https://correlaid.org/
https://correlaid.org//daten-nutzen/projektdatenbank/2023-10-ISH;Skalierung der Wirkungsmessung mit KI für In safe hands e.V.;{'Analyse von Sensordaten und ML': 'Künstliche Intelligenz', 'KI Anwendung': 'KI Anwendung', 'Prozessautomatisierung': 'Automatisierung', 'Interaktive App': 'Webanwendungen', 'Skalierung der Wirkungsmessung': 'Wirkungsmessung', 'Entscheidungsassistent': 'Virtuelle Assistenz', 'Output Monitoring': 'Wirkungsmessung'};{'Kinder- und Jugendhilfe': 'Jugendhilfe', 'Soziale Arbeit': 'Soziale Organisation', 'Wirkungsmessung': 'Gesundheit und Soziales'};;CorrelAid, In safe hands e.V.;In Weiterentwicklung;CorrelAid hat für In safe hands e.V. ein KI-gestütztes Tool entwickelt, das Vorschläge zur Kategorisierung offener Interviewantworten macht. Dies automatisiert die Auswertung von Teilnehmendenbefragungen, um die Wirkungsmessung des Vereins zu skalieren und zu vereinfachen.;;CC-BY 4.0;https://correlaid.org/
https://correlaid.org//daten-nutzen/projektdatenbank/2023-12-DEM;Demokratie-Wegweiser;{'Visualisierung': 'Datenreporting', 'Offene Daten': 'Öffentliche Daten', 'Interaktive Karte': 'Karten & Verzeichnisse', 'Digitale Plattform': 'Digitale Plattformen'};{'Demokratie': 'Politische Freiheiten', 'Partizipation': 'Inklusionspolitik', 'Transparenz': 'Inklusionspolitik'};https://karte.demokratie-wegweiser.de, https://civic-data.de/ein-wegweiser-fuer-die-demokratie/;CorrelAid, Civic Data Lab;In Betrieb;Das Projekt Demokratie-Wegweiser zielt darauf ab, die Transparenz demokratischer Prozesse auf lokaler Ebene zu erhöhen. Es fördert die politische Beteiligung, indem es Bürgern über eine zentrale Datenbank ermöglicht, direkt mit ihren Vertretern in Kontakt zu treten und Anliegen zu äußern.;;CC-BY 4.0;https://correlaid.org/
https://correlaid.org//daten-nutzen/projektdatenbank/2022-04-GER;R Wrapper for the Genesis API;{'Automatisierte Datenübermittlung': 'Datenmanagement', 'Datenanalyse': 'Datenanalyse', 'Datenerhebung': 'Datenerhebung', 'Offene Daten': 'Öffentliche Daten', 'Visualisierung': 'Datenreporting'};{'Offene Daten': 'Datenmanagement', 'Transparenz': 'Inklusionspolitik', 'Verwaltung': 'Soziale Organisation'};https://cran.r-project.org/web/packages/restatis/index.html;CorrelAid;In Weiterentwicklung;Das R-Paket 'restatis' verbessert und vereinheitlicht die Zugänglichkeit der Datenbanken des Statistischen Bundesamtes. Es ermöglicht eine optimierte Datenverarbeitung, Analyse und Visualisierung relevanter Informationen.;restatis;CC-BY 4.0;https://correlaid.org/
https://correlaid.org//daten-nutzen/projektdatenbank/2022-10-ETL;ETL Pipeline von Limesurvey zu einer Datenbank;{'Automatisierte Datenübermittlung': 'Datenmanagement', 'Datenanalyse': 'Datenanalyse', 'Datenerhebung': 'Datenerhebung', 'Prozessautomatisierung': 'Automatisierung'};{'Wissensmanagement': 'Soziale Organisation', 'Verwaltung': 'Soziale Organisation'};;CorrelAid, Anonyme Organisation;In Betrieb;Das CorrelAid-Team hat eine ETL-Pipeline entwickelt, um Umfragedaten effizient in eine Datenbank zu überführen. Dies ermöglicht eine verbesserte Datenverwaltung und -analyse für Non-Profits.;;CC-BY 4.0;https://correlaid.org/
https://correlaid.org//daten-nutzen/projektdatenbank/2022-10-LCR;Data Flow von R zu Metabase zu Google Docs: Ein Live-Connected Reporting-Workflow;{'Automatisierte Datenübermittlung': 'Datenmanagement', 'Bericht': 'Datenreporting', 'Dashboard': 'Datenreporting', 'Datenanalyse': 'Datenanalyse', 'Prozessautomatisierung': 'Automatisierung', 'Interne Datenanwendung': 'Interne Datenanwendung'};{'Wissensmanagement': 'Soziale Organisation', 'Transparenz': 'Inklusionspolitik'};;CorrelAid, Anonyme Organisation;Eingestellt;Dieses Projekt entwickelte Software-Tools, die einen live-verbundenen Datenfluss von R zu Google Docs über Metabase und Google AppScript ermöglichen. Die Tools automatisieren die Kuratierung von Metabase-Instanzen und synchronisieren Metabase-Dashboards und -Abfragen mit Google Sheets für technisch weniger versierte Nutzer*innen.;;CC-BY 4.0;https://correlaid.org/
https://correlaid.org//daten-nutzen/projektdatenbank/2022-07-COP;Unterstützung der Entscheidungsfindung für Fahrradparkplätze in Paris;{'Datenanalyse': 'Datenanalyse', 'Entscheidungsassistent': 'Virtuelle Assistenz', 'Interaktive Karte': 'Karten & Verzeichnisse', 'Offene Daten': 'Öffentliche Daten', 'Visualisierung mit Karten': 'Karten & Verzeichnisse'};{'Stadtplanung': 'Stadtentwicklung', 'Verwaltung': 'Soziale Organisation', 'Nachhaltigkeit': 'Umweltschutz', 'Offene Daten': 'Datenmanagement'};https://paris-bikes-wfiz3bgwsa-ew.a.run.app/;CorrelAid, City of Paris;In Betrieb;Das Projekt unterstützte die Stadt Paris bei der datengestützten Entscheidungsfindung für neue Fahrradparkplätze. Als Hauptergebnis wurde ein Prototyp des Paris Parking Demand Index in Form einer interaktiven Karte entwickelt.;;CC-BY 4.0;https://correlaid.org/
https://correlaid.org//daten-nutzen/projektdatenbank/2022-11-ATT;Qualitätsanalyse von OpenStreetMap Daten für Trinkbrunnen;{'Datenanalyse': 'Datenanalyse', 'Reporting': 'Datenreporting', 'Visualisierung': 'Datenreporting', 'Offene Daten': 'Öffentliche Daten', 'Digitale Plattform': 'Digitale Plattformen', 'Bericht': 'Datenreporting', 'Interaktive Karte': 'Karten & Verzeichnisse'};{'Umwelt': 'Umweltschutz', 'Nachhaltigkeit': 'Umweltschutz', 'Offene Daten': 'Datenmanagement', 'Stadt': 'Stadtentwicklung'};https://correlaid.github.io/trinkbrunnen-analyse/map-deutschland-drinking-water.html, https://correlaid.github.io/trinkbrunnen-analyse/analysis-fountains-germany.html;CorrelAid, a tip: tap e.V.;In Betrieb;Das Projekt analysiert OpenStreetMap-Daten zu Trinkbrunnen in Deutschland, um deren Anzahl pro 1000 Einwohner in verschiedenen Städten zu ermitteln und die Qualität der Metadaten zu bewerten.;;CC-BY 4.0;https://correlaid.org/
https://correlaid.org//daten-nutzen/projektdatenbank/2022-04-LAU;Entwicklung eines interaktiven Fragebogens zur Verbesserung von Kinderschutzmaßnahmen im Sport;{'Interaktiver Fragebogen': 'Datenerhebung', 'Interaktive App': 'Webanwendungen', 'Webentwicklung': 'Webanwendungen', 'Visualisierung': 'Datenreporting', 'Datenerhebung': 'Datenerhebung', 'Datenanalyse': 'Datenanalyse'};{'Kinderschutz': 'Jugendhilfe', 'Jugendarbeit': 'Jugendhilfe', 'Sport': 'Gesundheit und Soziales', 'Antidiskriminierung': 'Gegen Diskriminierung', 'Gewalt': 'Soziale Rechte', 'Teilhabe': 'Gesundheit und Soziales'};https://laureus.shinyapps.io/Safeinsport-selfaudit/;Laureus Sport for Good, CorrelAid;In Betrieb;Das Projekt entwickelte einen interaktiven Web-App-Fragebogen für Laureus Sport for Good, um Kinderschutzmaßnahmen in Sportorganisationen zu bewerten. Die App liefert automatisierte Empfehlungen und ermöglicht die systematische Erhebung und Auswertung von Daten, um Verbesserungsbedarfe aufzuzeigen.;;CC-BY 4.0;https://correlaid.org/
https://correlaid.org//daten-nutzen/projektdatenbank/2022-04-GEP;Python-Package für die GENESIS Datenbank;{'Automatisierte Datenübermittlung': 'Datenmanagement', 'Datenanalyse': 'Datenanalyse', 'Datenanwendung für Öffentlichkeit': 'Datenanwendung für Öffentlichkeit', 'Datenstandards': 'Datenmanagement', 'Datensatz und Visualisierung': 'Datenreporting', 'Offene Daten': 'Öffentliche Daten'};{'Offene Daten': 'Datenmanagement', 'Verwaltung': 'Soziale Organisation', 'Transparenz': 'Inklusionspolitik', 'Wissensmanagement': 'Soziale Organisation'};;CorrelAid;In Betrieb;Dieses Projekt ist ein Python-Package zur Verbesserung und Vereinheitlichung des Zugriffs auf die GENESIS-Online Datenbanken der statistischen Ämter des Bundes und der Länder, um Datenanalyse und Visualisierung zu erleichtern.;pystatis;CC-BY 4.0;https://correlaid.org/
https://correlaid.org//daten-nutzen/projektdatenbank/2022-07-MIP;Aufbau eines Systems zur Bewertung der Bodenqualität durch maschinelles Lernen und Computer Vision;{'Analyse von Sensordaten und ML': 'Künstliche Intelligenz', 'KI Anwendung': 'KI Anwendung', 'Computer Vision': 'Bildverarbeitung', 'Datenanalyse': 'Datenanalyse', 'Open Source Modellierung': 'Open-Source-Software'};{'Umweltschutz': 'Umweltschutz', 'Landwirtschaft': 'Soziale Organisation', 'Nachhaltigkeit': 'Umweltschutz'};;CorrelAid, Anonyme Organisation;In Weiterentwicklung;Ein CorrelAid-Team entwickelt in diesem Projekt ein Open Source System zur Bewertung der Bodenqualität mit Hilfe von maschinellem Lernen und Computer Vision.;;CC-BY 4.0;https://correlaid.org/
https://correlaid.org//daten-nutzen/projektdatenbank/2021-10-CAR;Alleinerziehend und arbeitslos: Analyse von Daten der Allgemeinen Sozialberatung der Caritas;{'Datenanalyse': 'Datenanalyse', 'Bericht': 'Datenreporting', 'Datenanwendung für Öffentlichkeit': 'Datenanwendung für Öffentlichkeit'};{'Armut': 'Soziale Hilfe', 'Beratung': 'Gesundheit und Soziales', 'Soziale Arbeit': 'Soziale Organisation', 'Wohlfahrt': 'Soziale Hilfe'};https://www.caritas.de/neue-caritas/heftarchiv/jahrgang2022/artikel/alleinerziehend-und-arbeitslos;Deutscher Caritasverband e.V., CorrelAid;Eingestellt;Das CorrelAid Team analysierte Daten der jährlichen Stichtagsbefragung der Klient*innen der Allgemeinen Sozialberatung des deutschen Caritasverbandes. Die Analyse zeigte, dass alleinerziehende Mütter ein deutlich höheres Risiko haben, langzeitarbeitslos zu werden, insbesondere bei niedrigem Bildungsniveau.;;CC-BY 4.0;https://correlaid.org/
https://correlaid.org//daten-nutzen/projektdatenbank/2021-04-KOB;R Wrapper für die KoboToolbox API;{'Automatisierte Datenübermittlung': 'Datenmanagement', 'Datenanalyse': 'Datenanalyse', 'Datenerhebung': 'Datenerhebung'};{'Humanitäre Hilfe': 'Soziale Hilfe', 'Wissensmanagement': 'Soziale Organisation'};;CorrelAid;In Betrieb;Das CorrelAid Team entwickelte ein R Package, das den programmatischen Zugriff auf die KoboToolbox API ermöglicht. Es dient dazu, Prozesse zur Datenerhebung, -verwaltung und -analyse zu automatisieren und Daten-Workflows zu verbessern.;kbtbr;CC-BY 4.0;https://correlaid.org/
https://correlaid.org//daten-nutzen/projektdatenbank/2021-07-SIL;Automatisierte Datenanalyse und Visualisierung für Silbernetz;{'Automatisierte Datenübermittlung': 'Datenmanagement', 'Datenanalyse': 'Datenanalyse', 'Dashboard': 'Datenreporting', 'Visualisierung': 'Datenreporting'};{'Senioren': 'Altershilfe', 'Wohlfahrt': 'Soziale Hilfe', 'Wirkungsmessung': 'Gesundheit und Soziales'};;CorrelAid, Silbernetz e.V.;In Betrieb;Das Projekt automatisierte die wöchentliche Auswertung von Anrufdaten für Silbernetz e.V. durch ein interaktives Shiny-Dashboard. Dies eliminierte manuelle Prozesse und schuf neue Visualisierungs- und Analysemöglichkeiten für die Arbeit des Vereins.;;CC-BY 4.0;https://correlaid.org/
https://correlaid.org//daten-nutzen/projektdatenbank/2021-04-SOS;Automatisierung Prozess Science on Stage e.V.;{'Prozessautomatisierung': 'Automatisierung', 'Datenanalyse': 'Datenanalyse', 'Datenerhebung': 'Datenerhebung', 'Bericht': 'Datenreporting', 'Visualisierung': 'Datenreporting'};{'Bildung': 'Bildungsberatung', 'Wissensmanagement': 'Soziale Organisation'};;Science on Stage e.V., CorrelAid;In Weiterentwicklung;Das CorrelAid-Projekt automatisierte und vereinheitlichte manuelle Datenverarbeitungsprozesse für Science on Stage e.V. mittels R-Skripten, um Zeit zu sparen und Fehler bei der Datenextraktion und -analyse aus Quellen wie Surveymonkey und Matomo zu vermeiden.;;CC-BY 4.0;https://correlaid.org/
https://correlaid.org//daten-nutzen/projektdatenbank/2021-03-NAK;Ein Dashboard zur Steigerung der Motivation von ehrenamtlichen Tutor*innen;{'Dashboard': 'Datenreporting', 'Webentwicklung': 'Webanwendungen', 'Datenanalyse': 'Datenanalyse'};{'Bildung': 'Bildungsberatung', 'Chancengleichheit': 'Geschlechtergerechtigkeit'};;CorrelAid, Anonyme Organisation;Unbekannt;CorrelAid unterstützte eine gemeinnützige Nachhilfeplattform bei der Entwicklung eines Dashboards. Dieses Dashboard visualisiert Metriken zur Nachhilfe, wie die Zufriedenheit der Schüler*innen, um ehrenamtliche Tutor*innen zu motivieren.;;CC-BY 4.0;https://correlaid.org/
https://correlaid.org//daten-nutzen/projektdatenbank/2021-03-HAC;Erstellung eines interaktiven Survey-Reports für die Hacklab Foundation, Ghana;{'Datenanalyse': 'Datenanalyse', 'Visualisierung': 'Datenreporting', 'Bericht': 'Datenreporting', 'Interaktive App': 'Webanwendungen', 'Umfrage': 'Datenerhebung'};{'Ghana': 'Afrika', 'International': 'Internationale Beziehungen', 'Bildung': 'Bildungsberatung', 'Technologie': 'Digitale Technologie'};https://correlaid.github.io/hacklab-foundation/Developer-Census-2020-Report.html;CorrelAid, Hacklab Foundation;In Betrieb;CorrelAid analysierte und visualisierte Umfragedaten für die Hacklab Foundation, Ghana, um Einblicke in die ghanaische Entwickler*innen-Community zu gewinnen. Die Ergebnisse wurden als interaktiver Bericht auf einer öffentlichen Webseite veröffentlicht, um die Arbeit der Hacklab Foundation zu verbessern und Entwickler*innen besser zu unterstützen.;;CC-BY 4.0;https://correlaid.org/
